"","ros_entity_number","ros_entity_name","ros_entity_type","ros_physical_address","ros_physical_city","ros_physical_state","ros_physical_zipcode"
"931",17017123,"city of chesapeake - data center","non-instructional facility (nif)","2130 S Military Highway","Chesapeake","VA",23320
"932",17017258,"biblioteca idn jayuya","library","Carr. #144 Km. 3.6","Jayuya","PR",664
"933",17017416,"port lions tribal library","library","2006 Airport Rd","Port Lions","AK",99550
"934",17017504,"taller de fotoperiodismo, inc.","library","312 AVE DE LA CONSTITUCION","SAN JUAN","PR",901
"935",17017542,"centro tecnológico comunitario stella","library","Calle #8","Rincón","PR",677
"936",17017611,"biblioteca félix a. yuyo matías santana","library","Calle Flamboyá","Toa Baja","PR",949
"937",17017654,"centro technologico bda roosevelt","library","Bda. Roosevelt 304 Calle 4","San Lorenzo","PR",754
"938",17017764,"oficinas administrativas de educación","non-instructional facility (nif)","Calle Luis Muñoz Rivera #26","Trujillo Alto","PR",976
"939",17017777,"centro tu tec pueblo","library","Calle Luis Muñoz Rivera #29","Trujillo Alto","PR",976
"940",17017779,"centro tu tec saint just","library","Centro Comunal Saint Jus","Trujillo Alto","PR",976
"941",17017780,"centro tu tec parcelas ramón t. colón","library","Carr 181 Bo. Quebrada Grande Calle 4 Parcelas Ramón T. Colón","Trujillo Alto","PR",976
"942",17017973,"fol book center","non-instructional facility (nif)","1301 N. Reynolds Rd.","Toledo","OH",43615
"943",17018453,"hosterian","non-instructional facility (nif)","11756 Borman Drive","St Louis","MO",63146
"944",17018516,"east bank regional library dr site","non-instructional facility (nif)","200 DERBIGNY ST.","GRETNA","LA",77053
"945",17018623,"commerce branch library","non-instructional facility (nif)","34 Commerce Street","Newark","NJ",7102
"946",17018701,"library services center","non-instructional facility (nif)","31-11 THOMSON AVENUE","NEW YORK","NY",11101
"947",20202,"library blind & handicapped","library","1500 Spring Garden Street","PHILADELPHIA","PA",19130
"948",203816,"bcl - aarlc & cc","library","20TH & SISTRUNK BLVD","FORT LAUDERDALE","FL",33311
"949",45019,"fort thomas branch library","library","1000 Highland Avenue","FORT THOMAS","KY",41075
"950",50641,"w gordon ryan library","library","103 LUCASVILLE-MINFORD RD","LUCASVILLE","OH",45648
"951",81409,"mack memorial library","library","1000 S ARKANSAS ST","SPRINGHILL","LA",71075
"952",16044478,"archival center","library","201 RIVERMOOR ST.","WEST ROXBURY","MA",2132
"953",16077206,"arlene cherry memorial library","library","909 W MAIN ST","CABOT","AR",72023
"954",17008055,"centro comunal oriente","library","Carr. 198 Km. 23.5, Comunidad Oriente","Las Piedras","PR",771
"955",17008056,"centro comunal pedro gonzález (la pepa)","library","Carr. 917 Km. 3.4","Las Piedras","PR",771
"956",17008057,"centro comunal boquerón","library","Carr. 936 Interior","Las Piedras","PR",771
"957",17008058,"centro comunal pueblito del río","library","Parcelas Nuevas Pueblito del Río","Las Piedras","PR",771
"958",17008061,"centro comunal pasto seco","library","Comunidad Pasto Seco Calle Amapola","Las Piedras","PR",771
"959",17008062,"centro comunal lijas","library","Carr. 31 Km. 15.4 Interior Comunidad Lijas","Las Piedras","PR",771
"960",17008064,"centro residencial parkhurst","library","Urb. Park Hurst, Calle Jesús T. Piñeiro","Las Piedras","PR",771
"961",17008068,"centro extension jardines de judelly","library","Calle Jose C. Barbosa, Km. 23.6 Interior","Las Piedras","PR",771
"962",17008070,"centro april garden apartments","library","Calle Jesús T. Piñero, Car. 183, Km. 21.2 Interior","Las Piedras","PR",771
"963",17008071,"centro res. la ribera","library","Carr. 198 Km. 22.4 Int.","Las Piedras","PR",771
"964",17008074,"centro res. bellas piedras","library","Bo. Quebrada Arenas, Sector Santana Velázquez","Las Piedras","PR",771
"965",17016805,"claremont branch library","library","308 E 167TH ST","BRONX","NY",10456
"966",17005291,"biblioteca municipal juana díaz","library","Plaza del Mercado de Juana Díaz, PR-14, Calle Comerio, K 9-12","Juana Díaz","PR",795
"967",17007697,"pitirre - conexion a tu recuperacion","library","Hospital Universitario DR. Ramon Ruiz Arnau (HURRA), Segundo Piso","Bayamon","PR",956
"968",16082514,"burlington county library kiosk","library","Moorsetown Mall 400 Route 38","Moorsetown","NJ",8057
"969",133860,"carnegie public library","library","East Broadway","Browns Valley","MN",56219
"970",50123,"indian mound branch library","library","45 Indian Dr","Enon","OH",45323
"971",128647,"mississippi library commission","library","3881 Eastwood Drive","Jackson","MS",39211
"972",17015001,"white mesa library-ute mountain ute tribe","library","33 Mesa View Dr","White Mesa","UT",84511
"973",16045290,"centro criollo del saber - bo. beatriz","library","Carr #1, (De Caguas A Cayey) Sector Los Panes","Caguas","PR",726
"974",16050426,"centro criollo del saber car?aboncito","library","Carr#1 Est 156, Esq Carr. #156,","Caguas","PR",726
"975",17008029,"biblioteca municipal caguas","library","38 Calle Padial","Caguas","PR",725
"976",16044478,"archival center","library","201 Rivermoor St.","West Roxbury","MA",2132
"977",108057,"san mateo county san carlos branch library","library","655 Chestnut St","San Carlos","CA",94070
"978",108459,"san mateo county foster city branch library","library","600 Foster City Blvd","San Mateo","CA",94404
"979",17014132,"centro cibernético yaurel","library","1 Calle E","Arroyo","PR",714
"980",17014134,"centro cibernético la palma","library","2 Calle E","Arroyo","PR",714
"981",17014135,"biblioteca cristobal l. sánchez","library","1 Calle San Eugenio # 17","Arroyo","PR",714
"982",17014136,"centro cibernético pithaya","library","Calle El Piojo","Arroyo","PR",714
"983",17014137,"centro cibernético barriada marín","library","Calle Safiro, Urb Las 500","Arroyo","PR",714
"984",17014138,"centro cibernético jatala antigua","library","Calle Cuadrado #4","Arroyo","PR",714
"985",17014139,"centro cibernético las 500","library","Bo Las 500 Calle 1 Esq 3","Arroyo","PR",714
"986",17014140,"centro cibernético punta guilarte","library","Centro Punta Guilarte #1","Arroyo","PR",714
"987",223689,"biblioteca publica de arroyo","library","Calle Virgilio Sanchez","Arroyo","PR",714
"988",16050468,"centro de tecnologia e informacion pithaya","library","Carr. 983 Km. 1.1 Bo Pitahaya","Liquillo","PR",773
"989",17010837,"biblioteca publica casa alcaldia","library","Calle 14 De Julio, Casa Alcaldia","Luquillo","PR",773
"990",16030444,"northeast historic film library","library","85 Main Street","Bucksport","ME",4416
"991",16033964,"sun city center library","library","1011 N Pebble Beach Blvd","Sun City Center","FL",33573
"992",16047038,"electronic library at children's services center","library","3110 Clay Mangum Ln","Tampa","FL",33618
"993",16080655,"planning commission library","library","601 E Kennedy Blvd Fl 18","Tampa","FL",33602
"994",17001259,"tampa free library","non-instructional facility (nif)","102 E 7th Ave","Tampa","FL",33602
"995",17015012,"electronic library at lee davis center","library","3402 N 22nd St","Tampa","FL",33605
"996",17017929,"hillsborough county public safety operations complex","non-instructional facility (nif)","9450 E. Columbus Dr","Tampa","FL",33619
"997",17011387,"delaware county library system- admin office","non-instructional facility (nif)","340 North Middletown Road , Bld 19","Delaware","PA",19063
"998",112324,"butte valley  dorris branch library","library","800 West 3rd St.","Dorris","CA",96023
"999",124149,"upper hudson library system","library","28 Essex St","Albany","NY",12206
"1000",17015450,"biblioteca maría nazareth","library","8142 Calle Concordia","Ponce","PR",717
"1001",16038629,"eagle hill athenaeum","library","59 Eagle Hill Road","Steuben","ME",4680
"1002",16044191,"georgetown historical society","library","20 Bay Point Rd","Georgetown","ME",4548
"1003",210912,"wawona   branch  library","library","7971 Chilnualna Falls Road","Wawona","CA",95389
"1004",226084,"coastal resource library at wells reserve","library","342 Laudholm Farm Rd","Wells","ME",4090
"1005",198519,"heartland regional library-iberia-miller county","library","304 N Saint Louis St","Iberia","MO",65486
"1006",123596,"ny metro ref/rsrch lib agency","library","599 11TH AVE FL 8","NEW YORK","NY",10036
"1007",128495,"buffalo river regional library","library","230 East James Campbell Blvd","COLUMBIA","TN",38401
"1008",16021247,"data center","library","7615 DISALLE BOULEVARD","FORT WAYNE","IN",46825
"1009",16060370,"barbara fasken branch library","library","15201 CERRALVO DR","LAREDO","TX",78045
"1010",16077379,"thistle cottage","library","122  S CHERRY ST","Greenville","KY",42345
"1011",16124,"greenwood reading center","library","2686 MAIN ST","GREENWOOD","NY",14839
"1012",17006552,"casa de la juventud","library","Calle Betances","Vega Baja","PR",693
"1013",17019515,"antonia spitzer jewish library  agudath israel of illinois","library","3542 W. Peterson Ave.","Chicago","IL",60659
"1014",17020337,"fairfield county library - kiosk","library","2201 Refugee Street","Millersport","OH",43046
"1015",225263,"clinton-macomb public library north branch","library","54100 Broughton Road","MACOMB","MI",48042
"1016",17019637,"ely shoshone tribal library","library","250 B Heritage Drive","Ely","NV",89301
"1017",17020852,"biblioteca aguedo mojica marrero","library","Ave. Jose Aguiar Aramburu Carr. 908 KM 1.2","Humacao","PR",792
"1018",143167,"polacca branch library","library","Highway 264 Mile Post 932","POLACCA","AZ",86042
"1019",17019233,"asociacion pro juventud","library","Calle Cucharillas #257","Barrio Palmas Catano","PR",962
"1020",17019317,"reno sparks hungry valley library","library","9055 Eagle Canyon Drive","Sparks","NV",89441
"1021",17020339,"double churches 24-hour public library","library","1241 Double Churches Rd","Columbus","GA",31904
"1022",17020342,"midland 24-hour public library","library","6600 Flat Rock Rd.","Midland","GA",31904
"1023",209402,"three rivers library system","library","11929 ELM STREET,   SUITE 18","OMAHA","NE",68144
"1024",124860,"western ny lib rsrcs council","library","4950 GENESEE ST STE 170","CHEEKTOWAGA","NY",14225
"1025",16067912,"talmage public library","library","2994 Main Street","TALMAGE","KS",67482
"1026",16084988,"coushatta tribe of louisiana library","library","1940 CC Bel Rd.","ELTON","LA",70532
"1027",17017929,"hillsborough county public safety operations complex","non-instructional facility (nif)","9450 E. COLUMBUS DR","TAMPA","FL",33619
"1028",17014106,"outreach facility","non-instructional facility (nif)","3434 North Boulevard","Baton Rouge","LA",70806
"1029",17020040,"pine creek","non-instructional facility (nif)","145 Railroad Street","Cammal","PA",17723
"1030",17019845,"walker river paiute tribe","library","1022 Hospital Road","Schurz","NV",89427
"1031",211732,"lakewood branch","library","3401 Ferrell Drive","Old Hickory","TN",37138
"1032",17019153,"salt lake county library daybreak library","library","11358 S Grandville Ave.","South Jordan","UT",84095
"1033",17019719,"lovelock paiute tribal library","library","201 Bowean St","Lovelock","NV",89419
"1034",123666,"north salem free library","library","RR 116","NORTH SALEM","NY",10560
"1035",16043418,"warehouse","non-instructional facility (nif)","3021 East 4th Avenue","COLUMBUS","OH",43219
"1036",17020221,"operations center","non-instructional facility (nif)","US SOUTH 62 & STYGLER ROAD","GAHANNA","OH",43230
"1037",16067361,"biblioteca carmen rosa diaz de olano","library","Po Box 428","Yabucoa","PR",767
"1038",16082839,"biblioteca comunitaria escuela cristobal santana melecio sat. de jsdcl","library","Calle 8","Dorado","PR",646
"1039",16082840,"biblioteca comunitaria escuela elisa davila vasquez, sat. de jsdcl","library","Carr. 679, Sect. Fortuna","Vega Alta","PR",692
"1040",16082841,"biblioteca comunitaria escuela rosa m. rodriguez, sat. de jsdcl","library","Calle Jupiter","Vega Baja Playa","PR",693
"1041",17010393,"biblioteca comunitaria escuela alfonso lopez garcia","library","Carr. 694, Barrio Maguayo","Dorado","PR",646
"1042",17010394,"biblioteca comunitaria escuela luis muñoz rivera","library","Barrio Mameyal","Dorado","PR",646
"1043",17021735,"amy van andel library & community center","library","7215 Headley St Se","Ada","MI",49301
"1044",17021184,"legacy park 247 library-in-a-box","library","2018 W. High St","Newark","OH",43055
"1045",17019806,"biblioteca comunitaria la casa del guaniqueno","library","Calle 25 De Julio #75","Guanica,","PR",653
"1046",16050809,"biblioteca publica la haya","library","Carr 3101 Sector La Haya, Bo. Lajas","Lajas","PR",667
"1047",16050810,"biblioteca pura platy, parguera","library","Carr 304 Final, Bo. Parguera","Lajas","PR",667
"1048",16051894,"biblioteca satelite - pugnado","library","Carr. 643 Km 2.4, Bo. Pugnado","Manati","PR",674
"1049",16051895,"biblioteca satelite - cortes","library","Carr. 667 Km 4.5, Sector Cortes Bajura Adentro","Manati","PR",674
"1050",16051896,"biblioteca satelite - boquillas","library","Carr. 685 Calle Estrella De Mar","Manati","PR",674
"1051",16051898,"biblioteca satelite - campo alegre","library","Carr. #2 Km 46.8, Sector Campo Alegre Cotto Norte","Manati","PR",674
"1052",16057985,"biblioteca satelite de monte bello","library","Carr. 642 K.M 6.0 Sector Monte Belllo Bo.","Manati","PR",674
"1053",16063575,"biblioteca electronica maguayo","library","Calle #1 Toro Maguayo","Lajas","PR",667
"1054",16064024,"biblioteca electronica cantito","library","Carr. 616 Barrio Cantito Adentro","Manati","PR",674
"1055",16067923,"route 9 library and innovation center","library","3022 Newcastle Ave","New Castle","DE",19720
"1056",16067925,"delaware division of libraries silver lake center","non-instructional facility (nif)","801 Silver Lake Boulevard","Dover","DE",19904
"1057",16072709,"bibliotgeca centro de sevicios multiples de anones","library","814 Rd. 4.0 Km, Anones Ward,Po Box 53","Naranjito","PR",719
"1058",16073026,"biblioteca sector las jaguas","library","Po Box 53, 164 Rd Km 8.4  Lomas Ward","Naranjito","PR",719
"1059",16073476,"acceso a la tecnologia guayabotas","library","Po Box 97, Road 182 Km 10 H 2","Yabucoa","PR",767
"1060",16073494,"acceso a la tecnologia aguacate","library","Road 906 Km 2 Bo Aguacate","Yabucoa","PR",767
"1061",17008286,"salón de los poetas","library","Paseo Del Atenas","Manatí","PR",674
"1062",17009675,"biblioteca publica lajas","library","Carr. 304 Pura Platti Gonzalez","Lajas","PR",667
"1063",17013805,"biblioteca electrónica doroteo peña mora","library","Carr. 182 Km 0.7 Bo Calabaza Arriiba","Yabucoa","PR",767
"1064",17013806,"biblioteca electrónica rosa sánchez","library","Calle 1 Esq Calle 2 Bo Rosa Sanchez","Yabucoa","PR",767
"1065",17013809,"biblioteca electrónica barrio ingenio","library","Calle 3 Bo Ingenio","Yabucoa","PR",767
"1066",17017736,"instituto de cultura puertorriquena","library","Avenida Constitucion #500","San Juan","PR",902
"1067",17018628,"salt lake county library operations building","non-instructional facility (nif)","9786 S Prosperity Rd","West Jordan","UT",84081
"1068",17018701,"library services center","non-instructional facility (nif)","31-11 Thomson Avenue","New York","NY",11101
"1069",17018944,"centro de desarrollo educativo del municipio de lajas","library","Carr. 117 Km. 1.5","Santa Rosa","PR",667
"1070",17021396,"yomba shoshone tribal library","library","Hc 61 Box 6275","Austin","NV",89310
"1071",17021511,"centro tecnológico palmarejo ii","library","Calle Monaco #117 Esquina Tailandia 118","Lajas","PR",667
"1072",17021512,"centro tecnológico comunitario surcando la historia","library","Calle Unión #34","Lajas","PR",667
"1073",17021564,"preston pc services","non-instructional facility (nif)","8118 304th Ave Se","Preston","WA",98050
"1074",27269,"mcmechen branch library","library","23 8th St","Mc Mechen","WV",26040
"1075",17013794,"tarkington community library","library","3032 Fm 163 Rd","Cleveland","TX",77327
"1076",16081057,"biblioteca mayaguez","library","#110 Calle Pilar Del Rillo","Mayaguez","PR",681
"1077",17006700,"biblioteca revndo eleuterio feliciano crespo main branch","library","Carr. 100 Km. 0.3, Ave. Las Cumbres","San Juan","PR",928
"1078",17006702,"vermont state library","library","109 State St","Montpelier","VT",5609
"1079",17009386,"biblioteca publica aguas buenas","library","39 Calle Rafael Lasa","Aguas Buenas","PR",703
"1080",17019361,"centro tecnológico rafael lasa","library","Calle Pedro Albizus Final #4","Aguas Buenas","PR",703
"1081",18645,"leola library center","library","48 W Main St","Leola","PA",17540
"1082",16028636,"biblioteca electronica de la juncia","library","Carr 156 Int 774","Comerio","PR",782
"1083",16028637,"biblioteca electronica de rio hondo","library","Carr 156 Entrada Al Pueblo","Comerio","PR",782
"1084",16028736,"centro educacional de tecnologia de hatillo","library","Bo. Hatillo Carr. 150. Km 3.5","Villalba","PR",766
"1085",16028743,"centro educacional de tecnologia de tierra santa","library","Comunidad Tierra Santa Paseo Albizu Campo","Villalba","PR",766
"1086",16028744,"centro educacional de tecnologia de apeaderos","library","Bo. Apeaderos Carr. 562 Km 1.9","Villalba","PR",766
"1087",16050195,"centro de tecnologia informatica aceituna","library","Carr. 547, Sector Aceituna, Bo. Vacas","Villalba","PR",766
"1088",16051530,"centro usos multiples manuel reyes baez","library","Carr, 779, Km 7.0","Comerio","PR",782
"1089",16051531,"biblioteca electronica de la prieta","library","Carr 781, Km 2.6","Comerio","PR",782
"1090",16051533,"centro comunal pinas","library","Carr, 775, Km 4.3","Comerio","PR",782
"1091",16051535,"centro usos multiples el verde","library","Carr, 782, Int. Carr 791, Bo. Naranjo","Comerio","PR",782
"1092",16051540,"centro comunal residencial rio plata","library","Carr 156, Km 3.3, 18 Calle A. Do. Palomas Abajo","Comerio","PR",782
"1093",16051542,"centro comunal vega redonda","library","Bo Naranjo Sector Sabana Carr 172 Km 1.6","Comerio","PR",782
"1094",16059710,"biblioteca electronica manuel martorell","library","Fisica: Barriada Passarell Calle 10","Comerio","PR",782
"1095",16064305,"book mobile","library","503 Kinsey Road","Xenia","OH",45385
"1096",16067171,"centro tecnologico la puntilla","library","Carr 156 Rte 749, Bo. Rio Hondo","Comerio","PR",782
"1097",17021361,"marion public library","library","100 S Cedar","Marion","SD",57043
"1098",206682,"pedro morales baez","library","Carr167sectorhiguerobo.Palomas","Comerio","PR",782
"1099",17010616,"biblioteca publica de maricao main branch","library","1 Calle Jose De Diego","Maricao","PR",606
"1100",17015504,"california state library - sutro","library","1630 Holloway Ave. Drive","San Francisco","CA",95132
"1101",16028506,"biblioteca electronica villa albizu candelaria","library","Carr 865 Km 5","Toa Baja","PR",949
"1102",16052551,"centro comunal macun","library","Calle Flamboyan","Toa Baja","PR",949
"1103",16052557,"centro comunal villa marisol","library","Calle Las Flores, Esquina Azucena","Toa Baja","PR",949
"1104",17006580,"biblioteca publica jaime fonalledas garriga (main branch)","library","Calle Munoz Rivera #56","Toa Baja","PR",951
"1105",17020118,"san juan ridge community library","library","18841 Oak Tree Rd","Nevada City","CA",95959
"1106",16052943,"centro mvil de educacion tecnologico","library","P. O. Box 2106","Orocovis","PR",720
"1107",16052944,"archivos historicos","library","P. O. Box 2106","Orocovis","PR",720
"1108",16052945,"centro cibernetico de orocovis","library","P. O. Box 2106","Orocovis","PR",720
"1109",17004074,"centro tecnológico ramona rosario (aspri)","library","Bo. Piñas Carr. 775 Km 0.6 Comerio (En El Pueblo Al Lado De Assmca","Comerio","PR",782
"1110",17004077,"centro tecnológico de servicios comunitarios de yabucoa (aspri)","library","Urb. Reparto Horizonte Calle 1 A-100  (En Los Altos Del Centro De Servicios Mutiples) (Al Final De La Calle Del Cementerio Municipal)","Yabucoa","PR",767
"1111",17004078,"centro tecnológico josefina rivera de aramburu (aspri)","library","Urb. Reparto Horizonte Calle 1 A-100 (Al Final De La Calle Del Cementerio Municipal)","Yabucoa","PR",767
"1112",17004080,"centro tecnológico rayito de luz (aspri)","library","Calle Cesár Gonzalez # C-1 (Antigua Biblioteca Municipal, Al Lado De La Alcaldia)","Adjuntas","PR",601
"1113",17004161,"centro de servicios múltiples de arroyo (aspri)","library","Calle Morse # 110 (En El Pueblo Al Lado De La Alcaldia, Antiguo Hospital De Arroyo)","Arroyo","PR",714
"1114",17004184,"centro tecnológico de servicios comunitarios de corozal (aspri)","library","Calle Nueva # 14 (Antiguas Facilidades Parque De Bombas)","Corozal","PR",783
"1115",17004185,"centro de servicios múltiples de lares (aspri)","library","Bo. Lares Carr. # 111 Km 22.8  (Cerca De Eco Max Gasoline)","Lares","PR",669
"1116",17004188,"centro de servicios múltiples de morovis aspri)","library","Barrio Unibon Parcelas Ramón Pabón,   (Cerca De La Cancha Bajo Techo)","Morovis","PR",687
"1117",17004192,"centro de servicios múltiples de aguadilla (aspri)","library","Calle Delicias # 1518 Barrio San Antonio Aguadilla,( Cerca Del Aeropuerto)","Aguadilla","PR",603
"1118",17004193,"centro de servicios múltiples de maricao (aspri)","library","Carretera 105 Interior (Al Costado Del Coliseo Municipal De Maricao),","Maricao","PR",606
"1119",17004199,"centro de servicios múltiples de san sebastián (aspri)","library","Ciudad De Oro Ave. Flamboyán # 500 Urb. Culebrinas","San Sebastián","PR",685
"1120",17004203,"centro tecnológico de río grande (aspri)","library","Carr. 187 Km 1.5 Barrio Herrera","Rio Grande","PR",745
"1121",17006275,"municipality of orocovis","library","Pr 157 Km 2.. Bo. Cacao","Orocovis","PR",720
"1122",17009812,"biblioteca publica orocovis library","library","Po Box 2106","Orocovis","PR",720
"1123",16057350,"biblioteca electronica espino","library","Barrio Espino, Carr. 109 Km. 5.8","Anasco","PR",610
"1124",16057353,"biblioteca electronica concovada","library","Barrio Concovada, Carr. 420 Km.3.7","Anasco","PR",610
"1125",16079907,"centro tec. caguabo","library","Carr. 115, Sector La Tosca, Cagubo, Anasco","Anasco","PR",610
"1126",16083949,"centro tecnologico daguey","library","Urb. Reparto Daguey, Calle #7","Anasco","PR",610
"1127",16083950,"centro tecnologico parcelas maria","library","Carr. 402 Km. 5 Bo. Marias","Anasco","PR",610
"1128",16083952,"centro tecnologico carreras cancha","library","Carr. 405 Km 1.2 Bo. Carreras","Anasco","PR",610
"1129",17008477,"biblioteca electronica estancia corazón","library","Carr. #2 Km. 15.7 Barrio Sábalos Edificio Casa De Salud","4to Piso Detrás Del Centro Médico De Mayagüez","PR",680
"1130",17009907,"biblioteca electronica de anasco - main branch","library","Calle San Antonio #17","Anasco","PR",610
"1131",16057390,"biblioteca electronica blondet","library","Carr. 3 Barrio Blondet","Guayama","PR",785
"1132",16057392,"biblioteca electronica guamani","library","Carr. 179 Barrio Guamani","Guayama","PR",784
"1133",16057393,"biblioteca electronica puente de jobos","library","Carr. 707 Barrio","Puente De Jobos","PR",785
"1134",16057394,"biblioteca electronica corazon","library","Carr. 748 Barrio","Corazon","PR",784
"1135",16059701,"biblioteca electronica luis pales matos","library","Carretera Machete 744","Guayama","PR",784
"1136",16063132,"biblioteca satelite olimpo","library","Bo. Olimpo Calle 1 Num 68 Esquina 2, Po Box 360","Guayama","PR",785
"1137",16063135,"biblioteca satelite barrancas","library","Barrancas Calle 3 #086, Po Box 360","Guayama","PR",785
"1138",16063137,"biblioteca satelite comunidad mosquito","library","Carr. 3 K.M. 155, Po Box 360","Guayama","PR",785
"1139",16063138,"biblioteca satelite pueblito del carmen","library","Bo Pueblito Del Carmen Carr.712 Int.7712","Guayama","PR",785
"1140",16068028,"biblioteca satelite borinquen","library","Francisco G Bruno Final","Guayama","PR",784
"1141",16068060,"biblioteca satelite de puerto jobos","library","Carr #3 Interseccion 707 Calle D","Guayama","PR",785
"1142",16068080,"biblioteca satelite carite","library","Carr. 179 Km 10.3","Guayama","PR",784
"1143",16068082,"biblioteca satellite cimarrona","library","Bo. Cimarrona Parcelas Vueva #90","Guayama","PR",784
"1144",16068088,"biblioteca satelite loma del viento","library","Calle Sol #152","Guayama","PR",784
"1145",16068090,"biblioteca satelite vives","library","Urb. Vives Calle C #143","Guayama","PR",784
"1146",17005291,"biblioteca municipal juana díaz","library","Plaza Del Mercado De Juana Díaz, Pr-14, Calle Comerio, K 9-12","Juana Díaz","PR",795
"1147",17008380,"biblioteca publica guayama main branch","library","Calle Ashford","Guayama","PR",784
"1148",17010144,"biblioteca rio canas abajo main branch","library","Calle # 2 Parcelas Viejas Del Rio Canas Abajo, Po Box 1409","Juana Diaz","PR",795
"1149",143269,"new mexico state library","library","1209 Camino Carlos Rey","Santa Fe","NM",87507
"1150",81915,"dunbar branch library","library","Nona St","Leesville","LA",71446
"1151",16061701,"centrol tecnologico aguas claras","library","Calle Rosa #202","Ceiba","PR",735
"1152",17020920,"resurgens, inc.  espiritu santo project","library","Oficina Administrativa","Aguas Buenas","PR",703
"1153",234319,"childrens museum of houston","library","1500 Binz","Houston","TX",77004
"1154",88668,"frank branch library","library","6440 W Bellfort St","Houston","TX",77035
"1155",16035594,"centro criollo de info-tomas de castro","library","Violet Street Bo. Tomas De Castro Parcela 1","Caguas","PR",726
"1156",148487,"the ohio public library information network (office)","library","2323 W 5th Ave. Suite 130","Columbus","OH",43204
"1157",16055335,"tccl support service center","non-instructional facility (nif)","1339 N. Lansing","Tulsa","OK",74106
